ClassN1,ID,TextoTratado,CreateTime,TotalTimeTracked,dominant_topic,top_words
ERP,17918,aplicativo colaborador viana atualizando print situacao atual admissao coligada admitido coligada,01/07/2025 16:12:20,420,8,"xml, sql, mysql, pdf, txt"
Infrastructure,17917,criacao regra alunos estiverem rede escola mfa,01/07/2025 15:17:36,2400,1,"tolerancia, montagem, administracao, unidade, pasta"
ERP,17916,medicao cliente trazendo municipio integracao tcop nucleus base oficial processo essencial cotrin utiliza rateio municipio medicao,01/07/2025 15:08:33,2400,2,"plano, agrupamento, tamanho, preco, moinho"
Infrastructure,17915,configurar notebook qualidade,01/07/2025 15:04:30,3360,3,"instalar, liberar, transferir, recuperar, portar"
ERP,17914,atualizacao base teste backup,01/07/2025 14:53:52,2040,2,"plano, agrupamento, tamanho, preco, moinho"
Infrastructure,17912,mapear pasta faria acesso edicao pasta duvida contactar,01/07/2025 13:35:36,600,1,"tolerancia, montagem, administracao, unidade, pasta"
ERP,17909,prosseguir faturamento direto contrato vide deducoes faturamento direto realizadas seguida feito faturamento,01/07/2025 11:31:01,1620,6,"ajustado, usado, explicado, solicitada, admitida"
Infrastructure,17908,crescer criacao correa vinq tiverem acesso,01/07/2025 10:16:54,1140,9,"encerrados, faturados, criadas, corrompidos, contabilizados"
Infrastructure,17907,instalacao maquina,01/07/2025 10:08:09,4800,1,"tolerancia, montagem, administracao, unidade, pasta"
Infrastructure,17906,chegou virus querer querendo baixei arquivo achei passando mostrar pre visualizacao deletei,01/07/2025 09:46:03,360,5,"carrega, sinaliza, possuia, inclui, executou"
ERP,17905,acesso movimentos modulo gestao estoque compras acerto contabil lancamentos eventos especialmente alterar amarracao conta contabil evitar lancamentos incorretos,01/07/2025 09:26:04,1200,4,"modelos, produtos, itens, fornecedores, cadastros"
Infrastructure,17904,cadastrar funcionario suprimentos viana viana grupos flow casa compras,01/07/2025 09:15:54,240,9,"encerrados, faturados, criadas, corrompidos, contabilizados"
ERP,17903,parametrizar visao time portal,01/07/2025 09:15:42,13080,1,"tolerancia, montagem, administracao, unidade, pasta"
Infrastructure,17902,disponibilizar acesso funcionario suprimentos viana perfil acesso possui,01/07/2025 09:11:47,360,3,"instalar, liberar, transferir, recuperar, portar"
ERP,17901,recebendo funcionario viana adequar acessos dele necessidades suprimentos bloquear acessos anteriores configurar perfil intranet alterar perfil acesso dele permissoes pastas rede bloquear acessos anteriores edicao pasta compras configurar computador,01/07/2025 08:51:09,2460,3,"instalar, liberar, transferir, recuperar, portar"
ERP,17900,sanar problemas cotacoes cotacao item multiplicando total unidades mantendo preco unitario apresentando fechar cotacao emitir ordem compra atualizacao compra parcial voltamos item cotacao itens voltando cotacao item entregue,01/07/2025 08:59:07,12300,3,"instalar, liberar, transferir, recuperar, portar"
Infrastructure,17899,recebendo funcionario viana adequar acessos dele necessidades suprimentos bloquear acessos anteriores configurar perfil intranet alterar perfil acesso dele passar permissoes possui pastas rede bloquear acessos anteriores acesso edicao pasta compras configuracao configurar computador necessidade telefones,01/07/2025 08:51:09,2520,3,"instalar, liberar, transferir, recuperar, portar"
ERP,17898,atestados emp spe moinho alterar,01/07/2025 08:44:55,720,3,"instalar, liberar, transferir, recuperar, portar"
Web services,17897,can you update the the annual financials and,01/07/2025 08:04:19,0,0,"first, seven, not, three, public"
Web services,17896,update the the current annual general meeting details held tuesday attached the proxy vif info circular and card,30/06/2025 17:17:17,0,0,"first, seven, not, three, public"
Infrastructure,17895,assinador utilizamos passou instalacao componente conseguir assinar documentos devemos proceder conseguiriam instalar maquinas diretamente,30/06/2025 16:56:32,120,5,"carrega, sinaliza, possuia, inclui, executou"
ERP,17893,liberar acessos gerador relatorios auxiliar indicadores,30/06/2025 16:02:45,1500,4,"modelos, produtos, itens, fornecedores, cadastros"
ERP,17892,reuniao alinhamento demandas,30/06/2025 15:39:30,2340,7,"entregas, telas, ferias, pastas, obras"
BI,17891,perfil usuario colaborador viana matricula registrar aparelho fisico instalado escritorio colaborador demitido coligada contratado enga coligada,30/06/2025 14:54:18,900,6,"ajustado, usado, explicado, solicitada, admitida"
Infrastructure,17889,espaco livre volume disco,30/06/2025 14:20:15,0,2,"plano, agrupamento, tamanho, preco, moinho"
Infrastructure,17887,perdi senha acesso control cadastro colaborador relogio hub enviar,30/06/2025 14:09:35,120,0,"first, seven, not, three, public"
Infrastructure,17885,retirem funciona,30/06/2025 12:55:22,300,5,"carrega, sinaliza, possuia, inclui, executou"
ERP,17884,fechamento importando batidas saida,30/06/2025 11:33:55,3120,7,"entregas, telas, ferias, pastas, obras"
Infrastructure,17882,configurando notebook decidam suprimentos qualidade,30/06/2025 10:54:53,3000,8,"xml, sql, mysql, pdf, txt"
ERP,17881,liberar acesso coligada usuario permissoes coligada,30/06/2025 10:48:50,900,3,"instalar, liberar, transferir, recuperar, portar"
ERP,17880,realizar cancelamento baixa feito errada vinculado realizar cancelamento erros,30/06/2025 10:48:43,1500,6,"ajustado, usado, explicado, solicitada, admitida"
Infrastructure,17879,computador lento demorando,30/06/2025 10:09:07,1200,8,"xml, sql, mysql, pdf, txt"
Infrastructure,17878,acesso rede,30/06/2025 09:26:20,180,1,"tolerancia, montagem, administracao, unidade, pasta"
ERP,17877,efetuar bloqueio acessos colaborador,30/06/2025 09:06:54,300,3,"instalar, liberar, transferir, recuperar, portar"
Infrastructure,17876,instalar equipamento wandra liberar permissao administrador usuario utiliza,30/06/2025 09:06:16,960,3,"instalar, liberar, transferir, recuperar, portar"
ERP,17875,acessar,30/06/2025 08:55:44,60,3,"instalar, liberar, transferir, recuperar, portar"
ERP,17874,pendencia aprovacao ferias colaboradora aparece portal,30/06/2025 08:48:08,1260,1,"tolerancia, montagem, administracao, unidade, pasta"
ERP,17872,baixa adiantamento baixa contabilizada,30/06/2025 08:45:03,19800,6,"ajustado, usado, explicado, solicitada, admitida"
ERP,17871,usuario bloqueado cancelamento usuarios joycy desligamento engenheira assumira aprovacoes joycy novolar liberar acesso aprovacao nisge estoril mirante vista vista prime view,30/06/2025 08:34:31,300,0,"first, seven, not, three, public"
ERP,17870,bresse puxando premio assiduidade colaboradores direito regras atendidas verificamos identificamos pedir evento entra folha zerado jardins puxou,30/06/2025 07:36:50,3960,5,"carrega, sinaliza, possuia, inclui, executou"
ERP,17869,hub importando saida periodo fechar,30/06/2025 06:09:14,1680,3,"instalar, liberar, transferir, recuperar, portar"
Infrastructure,17867,cancelar acessos funcionario,29/06/2025 13:07:53,360,3,"instalar, liberar, transferir, recuperar, portar"
ERP,17866,liberacao batida remoto possuo rotina visita obras precisaria liberacao bater entrada saida almoco,27/06/2025 18:30:02,540,1,"tolerancia, montagem, administracao, unidade, pasta"
Infrastructure,17865,esclarecimentos necessidade prospectos itens processo licitatorio informatica listados fosse apontado individualmente item necessario prospecto,27/06/2025 15:55:51,1920,4,"modelos, produtos, itens, fornecedores, cadastros"
ERP,17864,exclusao destes itens autorizacao excluir ficam financeiro,27/06/2025 14:46:45,300,4,"modelos, produtos, itens, fornecedores, cadastros"
Web services,17863,update our with the attached news release,27/06/2025 14:44:15,0,0,"first, seven, not, three, public"
Infrastructure,17862,liberar excel computadores estagiarios shellon obra flow,27/06/2025 14:26:53,900,8,"xml, sql, mysql, pdf, txt"
ERP,17861,habilitar acesso usuario habilitar acesso usuaria,27/06/2025 14:26:14,240,3,"instalar, liberar, transferir, recuperar, portar"
ERP,17860,seguem prints telas totvs reuniao,27/06/2025 14:23:03,3300,1,"tolerancia, montagem, administracao, unidade, pasta"
Infrastructure,17859,entrei recentemente recebi computador bassani configurado realizar atividades auxiliar,27/06/2025 14:17:17,1920,5,"carrega, sinaliza, possuia, inclui, executou"
ERP,17858,tirar duvida acessar portal retorna acessar,27/06/2025 14:14:17,480,3,"instalar, liberar, transferir, recuperar, portar"
ERP,17855,criar usuario colaborador inicia,27/06/2025 12:32:20,0,2,"plano, agrupamento, tamanho, preco, moinho"
Infrastructure,17854,visualizar pasta permissao aparece seja necessario mapear olhar,27/06/2025 12:06:11,1020,3,"instalar, liberar, transferir, recuperar, portar"
ERP,17853,acesso imobme xrm bloqueados desligamento corretora rabelo bloquear acesso cartao,27/06/2025 11:54:10,300,9,"encerrados, faturados, criadas, corrompidos, contabilizados"
Infrastructure,17852,acesso control ocorrido,27/06/2025 10:57:23,420,0,"first, seven, not, three, public"
Infrastructure,17851,configuracao note alterando visualizacao relatorios acesso vpn voecloud acessar configurar monitor escala,27/06/2025 10:55:14,300,8,"xml, sql, mysql, pdf, txt"
Infrastructure,17850,servidor funcionaria funcionando verificacao acesso anydesk,27/06/2025 10:41:17,480,5,"carrega, sinaliza, possuia, inclui, executou"
ERP,17849,percebi historicos lancamentos coligada mudaram houve modificacao,27/06/2025 10:16:50,180,5,"carrega, sinaliza, possuia, inclui, executou"
Infrastructure,17848,programarem formatacao computador colaborador,27/06/2025 09:45:10,10800,2,"plano, agrupamento, tamanho, preco, moinho"
ERP,17847,dificuldade excluir extratos compensados demonstrado print continuam relatorio,27/06/2025 09:30:24,600,6,"ajustado, usado, explicado, solicitada, admitida"
ERP,17846,coligada neeoh,27/06/2025 09:05:26,5400,3,"instalar, liberar, transferir, recuperar, portar"
Infrastructure,17843,login senha impressora,26/06/2025 17:14:12,600,1,"tolerancia, montagem, administracao, unidade, pasta"
ERP,17842,ecd coligada asamar cadastramos plano contas registro gerar ecd programa importando levando registro ipara ecf devemos proceder,26/06/2025 16:58:15,2940,2,"plano, agrupamento, tamanho, preco, moinho"
Infrastructure,17841,alinhar renovacao licencas painel bitdefender,26/06/2025 16:22:37,1440,1,"tolerancia, montagem, administracao, unidade, pasta"
Infrastructure,17839,enviar documento varredura encontradas exclusoes relacionadas perfil,26/06/2025 14:49:34,5280,9,"encerrados, faturados, criadas, corrompidos, contabilizados"
Infrastructure,17838,realizar migracao pasta clientes encerrados hospedada conta conta clientes inativos,26/06/2025 14:14:25,12660,4,"modelos, produtos, itens, fornecedores, cadastros"
Infrastructure,17835,redefinir senha acesso acessar intranet esquecimento senha,26/06/2025 12:34:39,600,1,"tolerancia, montagem, administracao, unidade, pasta"
ERP,17834,inserir substituicao logomarcas formularios folha backoffice ordens compra seja aplicada relatorios ordens compra documentos emitidos apresentem logos atualizacao totvs coligadas utilizam,26/06/2025 11:40:38,1740,7,"entregas, telas, ferias, pastas, obras"
ERP,17833,insercao logomarca agm coligada nota fiscal emitida totvs formularios ordem compra backoffice tenham arquivo adequada inclusao,26/06/2025 11:39:12,2100,1,"tolerancia, montagem, administracao, unidade, pasta"
ERP,17832,zerar banco horas colaboradora thaismara vilela leite registro agosto utiliza registro cargo confianca gestora horas fossem zeradas,26/06/2025 11:33:56,2160,9,"encerrados, faturados, criadas, corrompidos, contabilizados"
Infrastructure,17831,solicitacao bloqueio sites marketplace rede intranet,26/06/2025 10:33:21,1380,1,"tolerancia, montagem, administracao, unidade, pasta"
Infrastructure,17829,encaminhamento especificacao tecnica detalhada equipamento atendam necessidades processo licitatorio termino vigencia,26/06/2025 09:59:34,2100,2,"plano, agrupamento, tamanho, preco, moinho"
ERP,17828,processo importacao iptu apresentando deixa importacao planilha base medidas atualizacao iptu csv usado importacao erros apresentados,26/06/2025 09:44:50,1920,1,"tolerancia, montagem, administracao, unidade, pasta"
ERP,17827,atualizacao solicitacao criada aplicacao pacote vinculado ambiente contratado,26/06/2025 09:41:24,0,6,"ajustado, usado, explicado, solicitada, admitida"
Infrastructure,17826,impressora dias ficando off copyuai falou monitor cabo internet puder,26/06/2025 09:37:46,720,0,"first, seven, not, three, public"
Infrastructure,17825,recuperar corrompidos historico excel recuperar nomes incluir,26/06/2025 09:26:21,1680,3,"instalar, liberar, transferir, recuperar, portar"
ERP,17824,acesso usuario coligadas patio patio patio mirante,26/06/2025 08:56:22,1260,2,"plano, agrupamento, tamanho, preco, moinho"
Infrastructure,17823,atualizacao desktop conector exe baixado aplicativos autodesk acesso baixar,26/06/2025 07:54:26,3060,8,"xml, sql, mysql, pdf, txt"
ERP,17822,faturar itens sobras cotacao coligada liberado egp liberar,25/06/2025 18:30:54,0,3,"instalar, liberar, transferir, recuperar, portar"
ERP,17821,faturar itens sobras cotacao destinado itens coligada liberado egp liberar,25/06/2025 18:30:43,360,4,"modelos, produtos, itens, fornecedores, cadastros"
ERP,17820,rede bloqueados cancelamento acessos desligamento,25/06/2025 18:18:23,300,9,"encerrados, faturados, criadas, corrompidos, contabilizados"
ERP,17819,reuniao alinhamento demandas,25/06/2025 17:54:51,6240,7,"entregas, telas, ferias, pastas, obras"
ERP,17818,desligamento funcionaria lannes bloquear acessos havia desligamento fundir chamados finalizarmos recebem,25/06/2025 17:50:27,0,5,"carrega, sinaliza, possuia, inclui, executou"
ERP,17817,colaborador acessos totvs egp totvs pedidos pedidos extras ordem compra,25/06/2025 07:47:59,1860,1,"tolerancia, montagem, administracao, unidade, pasta"
ERP,17816,realizamos transferencia funcionario empreendimento jambreiro palm springs folha jambreiro consta resquicios custos funcionario avaliarem pontuado,25/06/2025 17:05:33,5700,5,"carrega, sinaliza, possuia, inclui, executou"
ERP,17815,criar coligada cnpj copiar parametros coligada patio,25/06/2025 16:26:16,20160,3,"instalar, liberar, transferir, recuperar, portar"
ERP,17814,solicitacao desligamento colaboradora hrs,25/06/2025 16:07:55,360,2,"plano, agrupamento, tamanho, preco, moinho"
ERP,17813,auxiliar coligada,25/06/2025 14:39:12,7680,3,"instalar, liberar, transferir, recuperar, portar"
ERP,17812,pagamento cliente conste pagina pericia vencimento,25/06/2025 14:17:45,14100,2,"plano, agrupamento, tamanho, preco, moinho"
Infrastructure,17810,note parou carregar usei carregador funcionou carregador estragou,25/06/2025 12:23:08,180,5,"carrega, sinaliza, possuia, inclui, executou"
ERP,17809,fechamento folha seguiu lancamento eventos coligada apresentou print evento remuneracao base emprestimo credito trabalhador coligada termos contabilizacao esocial,25/06/2025 12:15:57,480,2,"plano, agrupamento, tamanho, preco, moinho"
Infrastructure,17808,criar fante ffante mails utilizamos,25/06/2025 11:45:23,360,5,"carrega, sinaliza, possuia, inclui, executou"
Infrastructure,17807,esclarecimentos necessidade garantia tecnica itens processo licitatorio informatica listados fosse apontado individualmente item garantia fabricante,25/06/2025 11:23:38,1920,1,"tolerancia, montagem, administracao, unidade, pasta"
Infrastructure,17806,maquina pdf camera habilitada,25/06/2025 11:21:00,660,0,"first, seven, not, three, public"
ERP,17805,seja liberado usuario cadastro ferias semana ferias,25/06/2025 11:05:07,1440,7,"entregas, telas, ferias, pastas, obras"
ERP,17804,liberar criar acesso acessar portal,25/06/2025 11:04:51,600,3,"instalar, liberar, transferir, recuperar, portar"
ERP,17803,acesso aprovacao colaborada bastos acesso aprovacao,25/06/2025 10:35:43,600,6,"ajustado, usado, explicado, solicitada, admitida"
Infrastructure,17802,criacao recebimento obra empreendimento fonseca sacramento,25/06/2025 09:10:15,240,1,"tolerancia, montagem, administracao, unidade, pasta"
ERP,17801,importar emprestimo comercio ocorreu informando parametros emprestimo evento desconto emprestimo prefixo codigo sequencial emprestimo informados parametrizador folha mensal importacao importar emprestimo consignado,25/06/2025 08:29:38,2040,2,"plano, agrupamento, tamanho, preco, moinho"
Infrastructure,17800,pedir instalacao programa ucinet maquina brevidade,25/06/2025 08:18:38,720,1,"tolerancia, montagem, administracao, unidade, pasta"
ERP,17799,coligadas gestao patrimonial estacionamento certificados digitais atualizados substituir totvs,25/06/2025 08:00:47,1260,9,"encerrados, faturados, criadas, corrompidos, contabilizados"
Infrastructure,17798,liberacoes almoxarife obra supriani pedidos pedidos extras ordem compra pasta compartilhada obra intranet fluig qualitab,25/06/2025 07:47:59,2160,1,"tolerancia, montagem, administracao, unidade, pasta"
Infrastructure,17797,fluig,25/06/2025 07:41:34,540,0,"first, seven, not, three, public"
Infrastructure,17795,necessito direcionem mails chegam caixas entrada mails,24/06/2025 18:05:53,180,5,"carrega, sinaliza, possuia, inclui, executou"
BI,17794,correcao dashboard restabelecer acesso orcamentarias garantir tomada decisao reformulacao orcamento,24/06/2025 17:38:26,17700,3,"instalar, liberar, transferir, recuperar, portar"
Infrastructure,17793,instalacao software relogios,24/06/2025 16:54:12,28020,8,"xml, sql, mysql, pdf, txt"
ERP,17792,lancou registros marcados amarelo,24/06/2025 16:42:04,600,9,"encerrados, faturados, criadas, corrompidos, contabilizados"
Infrastructure,17791,programar troca plano fundo ficara ativo quinzena entra campanha seguranca informacao,24/06/2025 14:00:06,1380,1,"tolerancia, montagem, administracao, unidade, pasta"
Infrastructure,17790,acessar urgencia conectividade social cadastrar fgts instalacao acessar,24/06/2025 13:40:54,2280,3,"instalar, liberar, transferir, recuperar, portar"
ERP,17789,estoque backoffice coligada estoque coligada,24/06/2025 11:38:53,360,2,"plano, agrupamento, tamanho, preco, moinho"
ERP,17788,acesso horas via,24/06/2025 11:13:04,1200,7,"entregas, telas, ferias, pastas, obras"
ERP,17787,ajustar fiscal possuo acesso,24/06/2025 11:12:53,780,5,"carrega, sinaliza, possuia, inclui, executou"
ERP,17786,acessar recuperar senha sucesso ocorreu,24/06/2025 11:12:37,240,3,"instalar, liberar, transferir, recuperar, portar"
ERP,17785,aumentar campo nota fiscal gestao estoques fiscal itajuiassu digitos,24/06/2025 10:14:38,780,1,"tolerancia, montagem, administracao, unidade, pasta"
ERP,17784,vincular centros custo natureza,24/06/2025 10:11:42,540,1,"tolerancia, montagem, administracao, unidade, pasta"
Infrastructure,17783,impressora licitacao encontra off,24/06/2025 10:01:32,1320,0,"first, seven, not, three, public"
Infrastructure,17782,formatacao computador utilizo lentidao necessidade otimizacao backup completo documentos importantes procedimento agendar melhor realizacao servico,24/06/2025 10:00:08,1500,2,"plano, agrupamento, tamanho, preco, moinho"
ERP,17781,acesso criado usuario lareis senha lnytu acesso criacao acessos autorizacao engenheiro obra autorizado,24/06/2025 09:30:46,480,1,"tolerancia, montagem, administracao, unidade, pasta"
Infrastructure,17779,enfrentando acesso online maquinas internet funcionando sites testes identificamos bloqueado servidor regra seguranca firewall verificacao bloqueado desbloqueio restabelecer acesso,24/06/2025 08:19:28,1920,8,"xml, sql, mysql, pdf, txt"
ERP,17778,desligamento bloqueio acessos corretores emails bloqueados,23/06/2025 18:21:41,180,4,"modelos, produtos, itens, fornecedores, cadastros"
ERP,17776,comecando acesso portal,23/06/2025 18:12:21,420,2,"plano, agrupamento, tamanho, preco, moinho"
ERP,17775,desligamento bloqueio acessos corretores dordron melo novolar bloqueado,23/06/2025 18:00:12,180,4,"modelos, produtos, itens, fornecedores, cadastros"
ERP,17774,corretor encerrou contrato prestacao servicos bloquear acessos xrm imobme,23/06/2025 17:58:44,180,4,"modelos, produtos, itens, fornecedores, cadastros"
Infrastructure,17773,outlook exibindo opcao envio relacionamento realiza atualizacao volta ficar desconfigurado verifique enviando mails definido formato trabalho,23/06/2025 17:56:26,420,5,"carrega, sinaliza, possuia, inclui, executou"
ERP,17771,informacao inicia processo teste layout nfse nacional programacao respeito processo atender demanda apesar entrar vigor aberta testes,23/06/2025 14:48:00,240,2,"plano, agrupamento, tamanho, preco, moinho"
ERP,17770,workflow totvs alterar reajuste alugueis heb loja alterada,23/06/2025 13:01:46,1140,1,"tolerancia, montagem, administracao, unidade, pasta"
Infrastructure,17769,relatorio investimentos marketing power falhou,23/06/2025 12:30:10,300,0,"first, seven, not, three, public"
Infrastructure,17768,troca computador aprendiz departamento mesa direito,23/06/2025 12:11:26,240,2,"plano, agrupamento, tamanho, preco, moinho"
ERP,17767,consta tera feito extra saldo contrato tarefa eap aparece insumo resto entender melhor situacao,23/06/2025 11:37:02,2100,1,"tolerancia, montagem, administracao, unidade, pasta"
Infrastructure,17766,acesso archicad,23/06/2025 11:25:49,3840,2,"plano, agrupamento, tamanho, preco, moinho"
ERP,17765,reuniao alinhamento demandas,23/06/2025 11:18:53,4500,7,"entregas, telas, ferias, pastas, obras"
Infrastructure,17764,liberar acesso pacote office,23/06/2025 10:33:22,120,0,"first, seven, not, three, public"
ERP,17763,efetivada perdi acesso consegui acessar envelope pagamento realizar ajustes dias cadastrada continuo acesso funcionalidade registro correcao,23/06/2025 10:10:08,780,6,"ajustado, usado, explicado, solicitada, admitida"
Infrastructure,17762,power coletar indicadores agm consegui atualizacao modelo gateway ajudarem senao terei manualmente indicadores,23/06/2025 10:05:37,900,0,"first, seven, not, three, public"
Infrastructure,17761,registro certificado digital engenharia site conectividade social cef necessario baixar programa clicar download,23/06/2025 09:42:10,120,8,"xml, sql, mysql, pdf, txt"
ERP,17760,alteracao contribuicao sindical valores ajustados codigos fixos colaboradores envelope gerar folha puxando mudanca coligadas pontual gran boulevard terras oyama medidas,23/06/2025 09:34:59,1080,7,"entregas, telas, ferias, pastas, obras"
Infrastructure,17759,notebook conectava internet,23/06/2025 09:18:57,1020,5,"carrega, sinaliza, possuia, inclui, executou"
Infrastructure,17758,desliga mensagens agosto desativada,23/06/2025 09:18:26,480,7,"entregas, telas, ferias, pastas, obras"
ERP,17757,acesso cheque novolar avaliar,23/06/2025 09:16:07,720,3,"instalar, liberar, transferir, recuperar, portar"
ERP,17756,ponte duplica horas extras realizadas amanha feriado nacional visto colaboradores trabalhar,23/06/2025 09:15:28,10260,9,"encerrados, faturados, criadas, corrompidos, contabilizados"
ERP,17755,ajuste acesso contracheque agendamento ferias transferencia centro custo visualizar itens,23/06/2025 09:15:03,420,2,"plano, agrupamento, tamanho, preco, moinho"
ERP,17754,emissao boletos medidas atualizacao,23/06/2025 09:14:34,3000,7,"entregas, telas, ferias, pastas, obras"
ERP,17753,apresentando lentidao coligada aba,23/06/2025 09:13:54,960,1,"tolerancia, montagem, administracao, unidade, pasta"
ERP,17752,solucao conseguimos andamento compras itens,23/06/2025 08:38:24,4800,7,"entregas, telas, ferias, pastas, obras"
Infrastructure,17751,verificacao site funcionando computadores,23/06/2025 08:38:21,4200,8,"xml, sql, mysql, pdf, txt"
Infrastructure,17749,registrar reuniao telefonia realizada,20/06/2025 16:51:40,2580,6,"ajustado, usado, explicado, solicitada, admitida"
Infrastructure,17748,senha verificacao unica emitida confirmacao extra seguranca pin valido minutos altere senha considere ativar autenticacao fatores abra ligue,20/06/2025 16:25:31,0,5,"carrega, sinaliza, possuia, inclui, executou"
Infrastructure,17747,ddns net prestes expirar confirme host evitar seja removido dns dinamico aprimorado obter beneficios adicionais evitar confirmacao dias,20/06/2025 16:07:17,300,6,"ajustado, usado, explicado, solicitada, admitida"
ERP,17746,enviar cte tss medidas atualizacao,20/06/2025 15:54:50,900,8,"xml, sql, mysql, pdf, txt"
ERP,17744,liberacao acesso totvs projetos coligada usuarios,20/06/2025 11:42:32,420,4,"modelos, produtos, itens, fornecedores, cadastros"
ERP,17743,houve envios boletos clientes boletos enviamos cliente alega copiar emails grupoatr grupoatr respostas medidas,20/06/2025 11:09:54,600,4,"modelos, produtos, itens, fornecedores, cadastros"
ERP,17742,recebemos pagamento parcela unidade cliente cunha boleto realizar baixa indica ajustamos juros multa manualmente chegasse recebido prints ocorrido,20/06/2025 10:26:06,1080,5,"carrega, sinaliza, possuia, inclui, executou"
ERP,17741,criar conta coligada acesso incluir liberar usuario,20/06/2025 10:25:18,360,3,"instalar, liberar, transferir, recuperar, portar"
Infrastructure,17740,informada plataforma sat servidor bloqueando mails vindos dominio plataforma awarego bloqueio,20/06/2025 10:06:17,2280,8,"xml, sql, mysql, pdf, txt"
ERP,17739,usuarios brum lista usuarios totvs libere altere periodo lancamento totvs vejam alterar periodo usuarios,20/06/2025 10:01:39,3360,5,"carrega, sinaliza, possuia, inclui, executou"
Infrastructure,17738,possibilidade recuperar versao antiga arquivo auraem esq dimvao rlocalizado \\\\projetos\projetos validos\\projetos executivos\embasamento\esquadrias emb recuperar versao abril,20/06/2025 09:28:07,1200,1,"tolerancia, montagem, administracao, unidade, pasta"
ERP,17737,testei versao atualizada verificamos versao atual,20/06/2025 09:24:52,2220,5,"carrega, sinaliza, possuia, inclui, executou"
