ClassN1,ID,TextoTratado,CreateTime,TotalTimeTracked,dominant_topic,top_words
ERP,17736,atualizacao versao totvs erros,20/06/2025 09:23:47,960,1,"tolerancia, montagem, administracao, unidade, pasta"
Infrastructure,17735,restaurar liberacao acesso pasta trabalho criada armazenamento documentos pasta criada semana alimentada documentos desapareceu evidencia trata documentos producao backup necessarios breves entregas cliente,20/06/2025 08:43:02,1080,6,"ajustado, usado, explicado, solicitada, admitida"
ERP,17734,sped contabil metro erros centro custo ajustar cadastro centro custo parametros funcionou identificar gerar ecd,19/06/2025 15:29:42,4200,2,"plano, agrupamento, tamanho, preco, moinho"
ERP,17729,cadastrando empreendimento filial evolution buritis liberacao opcoes aba backoffice,18/06/2025 16:44:53,360,1,"tolerancia, montagem, administracao, unidade, pasta"
Infrastructure,17728,instalar hec hms versao computador conseguem auxiliar,18/06/2025 16:40:14,480,3,"instalar, liberar, transferir, recuperar, portar"
ERP,17727,ajuste formula visual campo previ emissao atual gerar irreais painel comprometimento,18/06/2025 16:19:46,1920,2,"plano, agrupamento, tamanho, preco, moinho"
ERP,17726,bloqueado cancelamento acessos corretora prado tonaco flores xrm imobme,18/06/2025 16:08:39,60,9,"encerrados, faturados, criadas, corrompidos, contabilizados"
ERP,17725,desligamento bloqueio acessos corretora teixeira amorim cpf novolar bloqueado,18/06/2025 16:07:29,360,9,"encerrados, faturados, criadas, corrompidos, contabilizados"
ERP,17724,atualizacao versao totvs mostrando item codigo produto totvs,18/06/2025 16:00:07,1680,1,"tolerancia, montagem, administracao, unidade, pasta"
Infrastructure,17723,instalacao programa dwg view maquina acesso anydesk,18/06/2025 15:09:00,1800,0,"first, seven, not, three, public"
Infrastructure,17722,criar usuarios alunos planilha alunos criar onedrive,18/06/2025 14:54:07,24420,4,"modelos, produtos, itens, fornecedores, cadastros"
Infrastructure,17721,guatemala alterar horario relogio laptop horario administrador acesso dificuldade marcar cumprir horarios causa,18/06/2025 13:52:37,420,2,"plano, agrupamento, tamanho, preco, moinho"
ERP,17720,ajusta valores sat ajustado txt contabil,18/06/2025 12:32:00,360,8,"xml, sql, mysql, pdf, txt"
ERP,17718,realizar bloqueio acesso usuario,18/06/2025 12:10:56,300,2,"plano, agrupamento, tamanho, preco, moinho"
ERP,17717,verificamos correcao colaboradores visualizar orientar dias visualizacao cruz jaudacy visualizacao visualizacao martinez,18/06/2025 12:04:46,360,3,"instalar, liberar, transferir, recuperar, portar"
ERP,17716,tento entrar portal apresenta,18/06/2025 12:00:59,240,5,"carrega, sinaliza, possuia, inclui, executou"
ERP,17715,txt contabil bate fechado folha base,18/06/2025 12:00:50,1260,6,"ajustado, usado, explicado, solicitada, admitida"
ERP,17714,atualizacao versao totvs relatorio financeiro utiliza,18/06/2025 11:44:13,1860,1,"tolerancia, montagem, administracao, unidade, pasta"
Infrastructure,17713,acessar pasta compartilhada,18/06/2025 11:43:55,300,6,"ajustado, usado, explicado, solicitada, admitida"
Infrastructure,17712,planilha travando,18/06/2025 11:32:15,3000,1,"tolerancia, montagem, administracao, unidade, pasta"
ERP,17711,realizar bloqueio desligamento,18/06/2025 11:18:48,240,2,"plano, agrupamento, tamanho, preco, moinho"
ERP,17710,realizar bloqueio desligamento,18/06/2025 11:18:26,180,2,"plano, agrupamento, tamanho, preco, moinho"
ERP,17709,realizar bloqueio desligamento,18/06/2025 11:17:53,180,2,"plano, agrupamento, tamanho, preco, moinho"
ERP,17708,realizar bloqueio desligamento,18/06/2025 11:17:38,120,2,"plano, agrupamento, tamanho, preco, moinho"
ERP,17707,bloqueios usuario desligamento,18/06/2025 11:17:17,120,2,"plano, agrupamento, tamanho, preco, moinho"
ERP,17706,bloqueios usuario desligamento,18/06/2025 11:16:55,180,2,"plano, agrupamento, tamanho, preco, moinho"
ERP,17705,bloqueios usuario desligamento,18/06/2025 11:16:36,120,2,"plano, agrupamento, tamanho, preco, moinho"
ERP,17704,realizarem bloqueio acesso fonseca redirecionar demandas,18/06/2025 11:16:19,120,3,"instalar, liberar, transferir, recuperar, portar"
Infrastructure,17703,retirar escritorio,18/06/2025 11:05:52,600,3,"instalar, liberar, transferir, recuperar, portar"
ERP,17702,ficha financeira consta saldo aplicando desconto cliente parcela portal cliente saldo abate desconto ajuste ficha portal cliente anexas fichas comparacao,18/06/2025 10:49:20,6060,2,"plano, agrupamento, tamanho, preco, moinho"
Infrastructure,17701,funcionando aparece encontrar conta google liberar acesso pasta compartilhada obra,18/06/2025 09:07:11,360,3,"instalar, liberar, transferir, recuperar, portar"
ERP,17700,fechando rescisao coligada medias,18/06/2025 08:57:13,4740,7,"entregas, telas, ferias, pastas, obras"
ERP,17699,coordenadora gestora qualidade visualizar registro totvs verifiquei secao chefe direto adicionar gestora secao gerencia qualidade,18/06/2025 08:56:08,1080,1,"tolerancia, montagem, administracao, unidade, pasta"
Infrastructure,17698,computador travando poucas janelas melhorar,18/06/2025 08:12:51,780,7,"entregas, telas, ferias, pastas, obras"
Infrastructure,17697,verificacao desktop connector sincronizando,18/06/2025 07:51:57,4320,8,"xml, sql, mysql, pdf, txt"
Infrastructure,17696,dispositivo srvsaft offline minutos acionando condicao device,18/06/2025 01:20:46,0,8,"xml, sql, mysql, pdf, txt"
Infrastructure,17695,agendar formatacao computador retirada elemento autocad instalar relacionado autodesk agendar terca alinhado anteriormente poucos repassando daqueles precisam formatacao autodesk,17/06/2025 19:45:02,9300,8,"xml, sql, mysql, pdf, txt"
ERP,17694,portal timeout servidor,17/06/2025 16:56:21,900,2,"plano, agrupamento, tamanho, preco, moinho"
ERP,17693,erros portal colaboradores portal timeout servidor,17/06/2025 16:56:21,5760,2,"plano, agrupamento, tamanho, preco, moinho"
Infrastructure,17692,reuniao orientacao abertura licitacao manutencao impressoras,17/06/2025 16:54:52,2880,1,"tolerancia, montagem, administracao, unidade, pasta"
Infrastructure,17691,acesso vpn,17/06/2025 15:43:53,360,8,"xml, sql, mysql, pdf, txt"
ERP,17690,gerar parcela colaborador considerou pdi calculo medidas atualizacao,17/06/2025 15:21:14,1920,5,"carrega, sinaliza, possuia, inclui, executou"
ERP,17689,base producao totvs versao recente versao base testes realizada atualizacao horario,17/06/2025 15:18:10,1800,1,"tolerancia, montagem, administracao, unidade, pasta"
Infrastructure,17688,monitor apagando frequentemente mau cabo monitor,17/06/2025 15:01:06,900,8,"xml, sql, mysql, pdf, txt"
ERP,17687,importar base produtos complementando base importada padrao,17/06/2025 14:36:40,1860,1,"tolerancia, montagem, administracao, unidade, pasta"
Infrastructure,17686,remanejado sala sinal licitacao ruim voltamos sala licitacao instalamos roteador cobrir sala temporariamente seja passado cabo ligar aps,17/06/2025 13:36:02,5400,1,"tolerancia, montagem, administracao, unidade, pasta"
Infrastructure,17685,conseguimos tirar ssd computador possui passar,17/06/2025 13:34:44,240,5,"carrega, sinaliza, possuia, inclui, executou"
BI,17684,replicar drill centro custo implementado dashboards permitindo visualizacao detalhamento despesas natureza facilitar consulta gestores ampliar transparencia orcamentaria,17/06/2025 11:57:55,30720,3,"instalar, liberar, transferir, recuperar, portar"
ERP,17683,principal apareca reclamante processo,17/06/2025 11:50:32,2640,2,"plano, agrupamento, tamanho, preco, moinho"
Cyber Security,17682,sat apontamento horas sat,17/06/2025 11:49:23,3900,0,"first, seven, not, three, public"
ERP,17681,acesso construcao backoffice pediu acesso,17/06/2025 11:37:48,2160,1,"tolerancia, montagem, administracao, unidade, pasta"
BI,17680,emitir relatorio clientes compraram lotes cidade profissao gerar relatorio,17/06/2025 11:25:57,8640,4,"modelos, produtos, itens, fornecedores, cadastros"
ERP,17679,lancar coligada vista juruaia aparece cod natureza obrigatorio salvar lancamento inscricao estadual certinho,17/06/2025 11:24:31,720,3,"instalar, liberar, transferir, recuperar, portar"
Infrastructure,17678,documento,17/06/2025 11:01:09,840,2,"plano, agrupamento, tamanho, preco, moinho"
ERP,17677,base teste ultima versao totvs backup base producao replicar base teste simular eventos,17/06/2025 10:07:50,2340,1,"tolerancia, montagem, administracao, unidade, pasta"
ERP,17676,transferencias feitas levando historico provisoes avaliar,17/06/2025 09:23:10,2160,7,"entregas, telas, ferias, pastas, obras"
ERP,17675,acesso contracheques ferias funcionarios obra spe americas,17/06/2025 09:21:33,420,4,"modelos, produtos, itens, fornecedores, cadastros"
Infrastructure,17674,acesso backup realizado computador,17/06/2025 09:20:58,240,8,"xml, sql, mysql, pdf, txt"
ERP,17673,acessar envelope pagamento envio atestado medico colaboradora afastada inss,17/06/2025 09:20:46,2520,2,"plano, agrupamento, tamanho, preco, moinho"
ERP,17672,criar usuario senha colaborador matricula registrar geolocalizacao conceder especial colaborador baixar usuario,17/06/2025 09:09:33,120,3,"instalar, liberar, transferir, recuperar, portar"
BI,17671,lancamento rescisao caindo juridico estando corretamente referenciado pacote folha caindo juridico,17/06/2025 08:50:53,1680,6,"ajustado, usado, explicado, solicitada, admitida"
ERP,17670,programar agenda minutos acesso remoto computador via anydesk configuracao emissao nota fiscal coligada semanas emitir nota fiscal conseguimos finalizar processo erros constantes agendar enviar invite amanha,17/06/2025 07:55:48,24660,3,"instalar, liberar, transferir, recuperar, portar"
Infrastructure,17669,acesso vpn voecloud acessar configurar monitor escala configurar monitor escala,16/06/2025 22:05:09,1620,3,"instalar, liberar, transferir, recuperar, portar"
ERP,17667,desligamento bloqueio acessos corretora nefertiti viana cpf novolar bloqueado,16/06/2025 17:57:24,300,9,"encerrados, faturados, criadas, corrompidos, contabilizados"
Infrastructure,17666,criacao recebimento obra empreendimento casa casa incluir fonseca sacramento,16/06/2025 17:52:59,540,1,"tolerancia, montagem, administracao, unidade, pasta"
ERP,17665,lancado atestado portal aprovado coligada apareceu historico colaborador,16/06/2025 17:29:17,1680,6,"ajustado, usado, explicado, solicitada, admitida"
ERP,17664,dificuldade exclusao baixa conciliado desfiz conciliacao extrato excluir baixa financeiro apareceram erros,16/06/2025 16:56:15,900,5,"carrega, sinaliza, possuia, inclui, executou"
Infrastructure,17663,removerem acessos bassani bbassani saffengenharia direcionarem mails mfvalente saffengenharia remova acessos pastas,16/06/2025 16:49:06,300,4,"modelos, produtos, itens, fornecedores, cadastros"
ERP,17662,venda dbdedaf,16/06/2025 16:12:12,2160,1,"tolerancia, montagem, administracao, unidade, pasta"
Infrastructure,17661,remover acessos zanon realizar backup liberar licenca remova acessos drive,16/06/2025 15:44:35,1320,3,"instalar, liberar, transferir, recuperar, portar"
ERP,17660,unidade bresse apresentando dias colaboradores registram gerada carga horaria negativa sabado reconhecido descanso colaboradores trabalharam compensacao auxiliar fechamento,16/06/2025 15:29:20,900,6,"ajustado, usado, explicado, solicitada, admitida"
ERP,17659,criar usuario senha colaboradores matricula matricula irao registrar geolocalizacao enga coligada,16/06/2025 15:28:23,840,3,"instalar, liberar, transferir, recuperar, portar"
Infrastructure,17658,bloquear acessos estagiarios caldeira mails,16/06/2025 15:23:16,360,4,"modelos, produtos, itens, fornecedores, cadastros"
ERP,17657,avaliassem possibilidade relatorio constando centro custo quantidade itens disponibilizados valores itens custo financeira gastos enviar,16/06/2025 15:17:53,5760,4,"modelos, produtos, itens, fornecedores, cadastros"
ERP,17655,relatorio distrato filtrado coligada centro custo periodo retornando relatorio cliente lote quadra distrato medidas baixa atualizacao,16/06/2025 14:28:44,1320,2,"plano, agrupamento, tamanho, preco, moinho"
Infrastructure,17654,detectamos login conta google necessaria ajudaremos proteger conta atividades seguranca enviado importantes conta google servicos relacionados,16/06/2025 13:57:13,0,8,"xml, sql, mysql, pdf, txt"
ERP,17653,cnpj campo atividade sap,16/06/2025 13:39:10,6480,1,"tolerancia, montagem, administracao, unidade, pasta"
Infrastructure,17652,entrar configuracao impressora ajustes teclado,16/06/2025 13:27:03,6300,4,"modelos, produtos, itens, fornecedores, cadastros"
Infrastructure,17651,unificando pastas adm seja realizada transferencia pasta central pagamentos recorrentes \financeiro\central pagamento recorrentes pasta administrativo \financeiro\administrativo necessario pasta administrativo permita acesso acessos bloqueados conseguem realizar,16/06/2025 12:11:58,540,1,"tolerancia, montagem, administracao, unidade, pasta"
Infrastructure,17650,agendar configuracao impressora computador certificar estabilizador apto computador,16/06/2025 11:37:42,1920,8,"xml, sql, mysql, pdf, txt"
Infrastructure,17649,necessito sincronizacao pastas desktop,16/06/2025 11:30:16,1440,8,"xml, sql, mysql, pdf, txt"
ERP,17648,liberar permissao desbloquear lancamento financeiro usuaria permissao cancelar lancamento desbloquear consiga cancelar cancelar lancamento financeiro aparece bloqueados liberar funcao excluir lancamentos cancelar aparece lancamento bloqueado,16/06/2025 11:10:48,840,3,"instalar, liberar, transferir, recuperar, portar"
Infrastructure,17647,computador desconfigurou impressora conectada puder olhar,16/06/2025 10:55:04,1920,8,"xml, sql, mysql, pdf, txt"
ERP,17645,acesso xrm imobme bloqueados desligamento bloqueio acessos corretor novolar,16/06/2025 10:05:48,120,2,"plano, agrupamento, tamanho, preco, moinho"
ERP,17644,acesso xrm imobme bloqueados cancelamento acessos corretor teixeira xrm imobme,16/06/2025 10:01:42,240,9,"encerrados, faturados, criadas, corrompidos, contabilizados"
Infrastructure,17643,computadores mesa gabinete conectando rede wifi tentamos varias maneiras reiniciamos rapidamente conecta desconecta volta funcionar acontecendo,16/06/2025 09:35:41,1920,5,"carrega, sinaliza, possuia, inclui, executou"
Infrastructure,17642,regra habilitada reiniciar computadores,16/06/2025 09:11:59,1920,4,"modelos, produtos, itens, fornecedores, cadastros"
ERP,17641,adiantamentos fornecedores pagamento adiantamento contabilizada vinculo baixa contabilizado seguem prints processo instrucoes reunir brevemente alinhamento,16/06/2025 09:10:48,3420,6,"ajustado, usado, explicado, solicitada, admitida"
Infrastructure,17640,computador recebendo enviando acontecendo dele,16/06/2025 08:35:33,0,8,"xml, sql, mysql, pdf, txt"
Infrastructure,17639,fluig,16/06/2025 08:27:16,180,0,"first, seven, not, three, public"
Infrastructure,17636,fluig,16/06/2025 07:54:33,540,0,"first, seven, not, three, public"
Infrastructure,17635,fluig acesso,16/06/2025 07:32:00,480,3,"instalar, liberar, transferir, recuperar, portar"
ERP,17634,orcado obra power contabil filtro obras orcado linha medido tcop,16/06/2025 07:09:34,11280,1,"tolerancia, montagem, administracao, unidade, pasta"
Infrastructure,17633,dispositivo offline minutos acionando condicao device,15/06/2025 15:28:37,720,8,"xml, sql, mysql, pdf, txt"
Infrastructure,17631,dispositivo srv offline minutos acionando condicao device,15/06/2025 15:28:37,0,8,"xml, sql, mysql, pdf, txt"
Infrastructure,17628,acessos shellon flow intranet sharepoint flow,14/06/2025 09:41:57,720,8,"xml, sql, mysql, pdf, txt"
ERP,17621,acessar atribuido,13/06/2025 17:47:06,480,6,"ajustado, usado, explicado, solicitada, admitida"
Infrastructure,17620,fosse verificada impressora escanear pedindo instalacao software instalado,13/06/2025 16:40:17,180,6,"ajustado, usado, explicado, solicitada, admitida"
ERP,17619,criar usuario senha valente matricula registrar geolocalizacao quadra coligada,13/06/2025 16:25:33,300,3,"instalar, liberar, transferir, recuperar, portar"
ERP,17618,criar usuario senha matricula registrar geolocalizacao,13/06/2025 16:22:36,540,3,"instalar, liberar, transferir, recuperar, portar"
ERP,17617,ajuste mudando custo alterados campos complementares incidir pedidos lancamentos forem explicar impactos,13/06/2025 15:58:47,3600,4,"modelos, produtos, itens, fornecedores, cadastros"
ERP,17615,desligamento bloqueio acessos corretor cpf novolar bloqueado,13/06/2025 12:46:36,240,2,"plano, agrupamento, tamanho, preco, moinho"
ERP,17612,ajuste sgcc gestao orcamentaria,13/06/2025 11:48:18,540,1,"tolerancia, montagem, administracao, unidade, pasta"
ERP,17611,retirar log excluiu boleto especifico mostrar retirar log,13/06/2025 11:35:06,2520,3,"instalar, liberar, transferir, recuperar, portar"
Infrastructure,17610,saturacao camera,13/06/2025 11:13:44,720,0,"first, seven, not, three, public"
ERP,17609,ajustar coligada relatorio inss agm rat,13/06/2025 10:28:48,660,0,"first, seven, not, three, public"
Infrastructure,17608,formalizacao troca teclado maquina,13/06/2025 10:26:44,300,1,"tolerancia, montagem, administracao, unidade, pasta"
Infrastructure,17607,instalem programa ucinet,13/06/2025 10:08:30,420,2,"plano, agrupamento, tamanho, preco, moinho"
Infrastructure,17606,liberar acesso intranet sheillon,13/06/2025 09:20:24,180,3,"instalar, liberar, transferir, recuperar, portar"
Infrastructure,17604,energia sede presenca ligacoes wifi servidor,13/06/2025 08:51:28,8100,1,"tolerancia, montagem, administracao, unidade, pasta"
Infrastructure,17603,login poletti,13/06/2025 08:46:08,240,8,"xml, sql, mysql, pdf, txt"
ERP,17602,desenvolvimento cubo relatorios especifico planilhas gastos enviadas fosse criado cubo planilhas incluindo completos sac,13/06/2025 08:37:10,29400,7,"entregas, telas, ferias, pastas, obras"
ERP,17600,duvida compensacao solucao correta compensacao feriado colaboradores ficam devendo horas,13/06/2025 08:30:09,29100,5,"carrega, sinaliza, possuia, inclui, executou"
Infrastructure,17597,movendo equipamentos caixas acessorios cpd liberar espaco,13/06/2025 07:58:35,9060,4,"modelos, produtos, itens, fornecedores, cadastros"
ERP,17596,chapa coligada registrado aplicativo informando geolocalizacao gps ativado,12/06/2025 18:45:38,2520,6,"ajustado, usado, explicado, solicitada, admitida"
Infrastructure,17595,faca varredura nuvem arquivo pasta documento tenham principalmente pasta cliente ferbasa gere relatorio apresentando resultado varredura,12/06/2025 17:20:33,1800,1,"tolerancia, montagem, administracao, unidade, pasta"
Infrastructure,17594,patch maquina,12/06/2025 16:41:51,1920,1,"tolerancia, montagem, administracao, unidade, pasta"
Infrastructure,17593,instalacao patch somasrvw,12/06/2025 16:39:44,420,0,"first, seven, not, three, public"
Infrastructure,17590,avaliar vista seguranca software,12/06/2025 16:28:13,1380,3,"instalar, liberar, transferir, recuperar, portar"
Infrastructure,17589,criar acesso rede shellon,12/06/2025 16:27:28,1260,3,"instalar, liberar, transferir, recuperar, portar"
ERP,17588,integrar lotes teste coligada coligada conferiu contabilidade enviar reinf sped fiscal amanha,12/06/2025 16:03:18,1500,3,"instalar, liberar, transferir, recuperar, portar"
ERP,17587,acessar login senha cadastrei invalida seleciono esqueci senha recebo recuperar reinicializar senha spam lixo auxiliar login,12/06/2025 15:57:31,360,5,"carrega, sinaliza, possuia, inclui, executou"
ERP,17586,acha incluir coluna salario base cubo,12/06/2025 15:50:42,480,1,"tolerancia, montagem, administracao, unidade, pasta"
ERP,17585,avaliar ecf parametrizada ambiente,12/06/2025 15:17:13,5700,3,"instalar, liberar, transferir, recuperar, portar"
Infrastructure,17584,alterou acesso anonimo mapas projeto desejar pessoas acessem item anonimamente remova,12/06/2025 14:53:22,0,5,"carrega, sinaliza, possuia, inclui, executou"
ERP,17575,tento importar funcionario aparece batidas dele,12/06/2025 14:25:36,1320,7,"entregas, telas, ferias, pastas, obras"
ERP,17574,realizar importacao acordo relogio deg andar registros coletados maio maio houve cadastro biometria maio registros incluidos portal meurh,12/06/2025 14:25:23,660,9,"encerrados, faturados, criadas, corrompidos, contabilizados"
ERP,17573,lancando receita consorcio roscoe retc contabilidade aparece consorcio mrfgentileza,12/06/2025 14:09:44,1200,1,"tolerancia, montagem, administracao, unidade, pasta"
Infrastructure,17572,enviar status atual backup,12/06/2025 13:11:08,2280,3,"instalar, liberar, transferir, recuperar, portar"
Infrastructure,17571,espaco livre volume disco,12/06/2025 11:47:26,120,2,"plano, agrupamento, tamanho, preco, moinho"
Infrastructure,17570,configurar monitor escala vpn notebook funciona configurar,12/06/2025 11:45:51,0,8,"xml, sql, mysql, pdf, txt"
Infrastructure,17569,houve tentativa login bloqueada conta recomendamos atividade seguranca reconhecer conta remova recuperacao,12/06/2025 11:25:34,0,5,"carrega, sinaliza, possuia, inclui, executou"
Infrastructure,17568,configuracao ddns redes wifi rede convidado acessa portal senha resultadossixtema definir limite conexao horas rede estudiosix secundario banda senha estudiosixrede integration coworking senha integrattionrede better every day interno senha,12/06/2025 11:23:15,5100,0,"first, seven, not, three, public"
Infrastructure,17566,instalar power inserindo conta pin administrador instalacao auxilio,12/06/2025 10:53:24,1200,0,"first, seven, not, three, public"
ERP,17565,acesso simples consulta contracheques,12/06/2025 09:59:09,720,4,"modelos, produtos, itens, fornecedores, cadastros"
ERP,17564,incluir boleto lancamento apresentado,12/06/2025 09:49:27,60,6,"ajustado, usado, explicado, solicitada, admitida"
ERP,17563,testarem acesso documentacao resultado marcarei reuniao explicar cliente,12/06/2025 09:10:10,1200,3,"instalar, liberar, transferir, recuperar, portar"
Infrastructure,17562,licitacao assinado notebook funcionamento camera,12/06/2025 09:01:34,540,0,"first, seven, not, three, public"
Infrastructure,17561,notebook acessando servidor verificacao,12/06/2025 08:58:54,900,8,"xml, sql, mysql, pdf, txt"
ERP,17560,imprimir contrato fornecedor auxiliar,12/06/2025 08:38:15,840,3,"instalar, liberar, transferir, recuperar, portar"
Infrastructure,17559,relatorio reune relatorios salvos unico documento relatorio,12/06/2025 08:00:51,0,2,"plano, agrupamento, tamanho, preco, moinho"
Infrastructure,17558,relatorio reune relatorios salvos separados unico documento relatorio,12/06/2025 08:00:37,0,9,"encerrados, faturados, criadas, corrompidos, contabilizados"
Infrastructure,17557,dispositivo servidor offline minutos acionando condicao device,11/06/2025 18:46:27,0,8,"xml, sql, mysql, pdf, txt"
ERP,17555,colaboradora cadastrada,11/06/2025 16:58:13,1140,6,"ajustado, usado, explicado, solicitada, admitida"
Infrastructure,17554,urgencia encerre acessos colaborador,11/06/2025 16:49:59,720,5,"carrega, sinaliza, possuia, inclui, executou"
ERP,17553,criar usuario senha shellon matricula registrar geolocalizacao savassi coligada,11/06/2025 16:48:10,420,3,"instalar, liberar, transferir, recuperar, portar"
Infrastructure,17552,acesso sketchup teams,11/06/2025 16:27:35,2820,0,"first, seven, not, three, public"
ERP,17551,opcao ambiente teste liberar usuario,11/06/2025 16:11:30,1680,2,"plano, agrupamento, tamanho, preco, moinho"
Infrastructure,17550,realizar tecnica gabinete vereador farmacia computador desligado resposta,11/06/2025 16:10:44,1320,1,"tolerancia, montagem, administracao, unidade, pasta"
ERP,17549,conversado telefone contabilidade base calculo tributos pis cofins cumulativos cumulativos,11/06/2025 16:09:28,4260,1,"tolerancia, montagem, administracao, unidade, pasta"
ERP,17548,periodo ferias cadastrado aguardando aprovacao,11/06/2025 16:03:59,240,7,"entregas, telas, ferias, pastas, obras"
ERP,17547,importar arquivo emprestimo consignado consegui labore opcao escolher evento lancamento,11/06/2025 15:46:14,7020,2,"plano, agrupamento, tamanho, preco, moinho"
Infrastructure,17546,inacessivel verificarem,11/06/2025 15:05:27,720,5,"carrega, sinaliza, possuia, inclui, executou"
ERP,17545,estoque reuniao estoque,11/06/2025 15:04:37,1200,2,"plano, agrupamento, tamanho, preco, moinho"
ERP,17544,abrindo vermos atualizacao plataforma qive ativa migrou usuarios portal medidas baixa atualizacao,11/06/2025 11:36:46,8280,7,"entregas, telas, ferias, pastas, obras"
Infrastructure,17543,conta sena ativa funcionamento normal plataforma sat identificou problemas enviar conta,11/06/2025 10:43:23,900,5,"carrega, sinaliza, possuia, inclui, executou"
ERP,17542,regerei lancamentos coligada contabilidade refiz lancamentos entendi lancamentos ficariam vencimento,11/06/2025 10:29:20,8880,5,"carrega, sinaliza, possuia, inclui, executou"
ERP,17541,importar lancamentos folha maio coligada retc infraestrutura lote manha haja inconsistencia,11/06/2025 09:58:48,1080,1,"tolerancia, montagem, administracao, unidade, pasta"
ERP,17540,marcar ferias,11/06/2025 09:34:26,9660,7,"entregas, telas, ferias, pastas, obras"
Infrastructure,17539,funcionamento camera notebook funcionando,11/06/2025 09:22:37,3300,8,"xml, sql, mysql, pdf, txt"
Infrastructure,17538,internet funcionando notebook seja verificada situacao mau funcionamento internet notebook,11/06/2025 09:21:22,1500,1,"tolerancia, montagem, administracao, unidade, pasta"
Infrastructure,17537,relatorio reune relatorios salvos unico documento relatorio,11/06/2025 08:01:00,0,2,"plano, agrupamento, tamanho, preco, moinho"
Infrastructure,17536,relatorio reune relatorios salvos separados unico documento relatorio,11/06/2025 08:00:48,0,9,"encerrados, faturados, criadas, corrompidos, contabilizados"
Infrastructure,17535,avaliar renovacao aquisicao office,11/06/2025 07:18:31,13200,0,"first, seven, not, three, public"
