ClassN1,ID,TextoTratado,CreateTime,TotalTimeTracked,dominant_topic,top_words
Infrastructure,18332,internet sites,17/07/2025 09:41:34,2400,4,"modelos, produtos, itens, fornecedores, cadastros"
ERP,18330,pixioline desligado bloqueio dele acesso bloqueado,16/07/2025 17:06:25,120,6,"ajustado, usado, explicado, solicitada, admitida"
ERP,18329,desligada bloqueio acesso bloqueado,16/07/2025 17:05:59,60,6,"ajustado, usado, explicado, solicitada, admitida"
ERP,18328,desligado bloqueio dele acesso bloqueado,16/07/2025 17:05:46,240,6,"ajustado, usado, explicado, solicitada, admitida"
ERP,18327,cotacao fornecimento montagem loco reservatorio inferior capacidade total litros agua podendo dividido modulos atender limitacoes espaco subsolo capacidade total seja mantida superada avaliar ajustes posicoes conexoes necessario,16/07/2025 17:05:42,0,6,"ajustado, usado, explicado, solicitada, admitida"
ERP,18326,bloqueio desligamento redirecionar demanda bloqueado,16/07/2025 16:58:18,120,6,"ajustado, usado, explicado, solicitada, admitida"
Infrastructure,18316,acessar teams planilhas senha resetada acesso teams planilhas ocorre licenca basic aplicativos office navegador planilha favoritos,16/07/2025 14:36:13,2100,0,"first, seven, not, three, public"
ERP,18314,liberacao usuario parcial liberados obras projetos backoffice contexto quadra liberado liberacoes formulario enviado agilidade liberacoes acesso intranet trabalho pasta compartilhada urgencia,16/07/2025 13:09:46,2520,6,"ajustado, usado, explicado, solicitada, admitida"
Infrastructure,18312,comeca provavelmente precisar acessos,16/07/2025 12:40:36,120,4,"modelos, produtos, itens, fornecedores, cadastros"
ERP,18311,colaboradora matricula coligada quadra retornando ferias acessar gerar senha usuario acessar aplicativo,16/07/2025 11:50:24,300,3,"instalar, liberar, transferir, recuperar, portar"
ERP,18310,webinar totvs clock webinar totvs clock,16/07/2025 11:36:56,4380,1,"tolerancia, montagem, administracao, unidade, pasta"
ERP,18309,webinar totvs clockin,16/07/2025 11:31:30,5400,1,"tolerancia, montagem, administracao, unidade, pasta"
ERP,18303,apuracao quantidade funcionarios clientes reuniao parceiro,16/07/2025 09:43:17,1800,4,"modelos, produtos, itens, fornecedores, cadastros"
ERP,18301,rede portas bloqueados bloqueio acessos desligamento,16/07/2025 09:16:19,120,9,"encerrados, faturados, criadas, corrompidos, contabilizados"
ERP,18299,agrupamento movimentos aparece enviar nota identificador tss retorna nota campo tamanho permitido tornando schema xml invalido,16/07/2025 08:00:05,900,8,"xml, sql, mysql, pdf, txt"
ERP,18298,atualizacao patch recente,15/07/2025 20:43:58,4500,0,"first, seven, not, three, public"
Infrastructure,18297,upgrade from basic standard sku public addresses september basic sku retired and you longer able create new basic sku public addresses after march,15/07/2025 19:20:21,0,0,"first, seven, not, three, public"
Infrastructure,18296,deslocamento casa,15/07/2025 17:26:04,4200,1,"tolerancia, montagem, administracao, unidade, pasta"
Infrastructure,18295,teams acesso login senha alterada,15/07/2025 17:13:45,1020,6,"ajustado, usado, explicado, solicitada, admitida"
ERP,18294,resetar senha usuario resetar senha campos,15/07/2025 17:00:38,780,1,"tolerancia, montagem, administracao, unidade, pasta"
ERP,18292,realizar cadastro funcionario transferido obra fleming aparece possui cadastro realizar cadastro relogio necessario aguardar transferencia dele obra estoril,15/07/2025 15:46:20,120,3,"instalar, liberar, transferir, recuperar, portar"
ERP,18291,reuniao alinhamento acesso banco rotinas,15/07/2025 15:32:32,1800,7,"entregas, telas, ferias, pastas, obras"
Infrastructure,18289,acesso impressora colorida,15/07/2025 14:53:06,1500,1,"tolerancia, montagem, administracao, unidade, pasta"
ERP,18288,centro custo natureza naturezas centros custos,15/07/2025 14:27:25,1020,4,"modelos, produtos, itens, fornecedores, cadastros"
ERP,18286,desligamento bloqueio acessos gerente gerente house vendas barreto novolar mails bloqueados,15/07/2025 14:06:17,480,9,"encerrados, faturados, criadas, corrompidos, contabilizados"
ERP,18285,centro custo usuario,15/07/2025 14:00:28,240,2,"plano, agrupamento, tamanho, preco, moinho"
ERP,18284,centro custo usuario,15/07/2025 13:26:50,240,2,"plano, agrupamento, tamanho, preco, moinho"
Infrastructure,18283,acesso pasta acesso pasta locacao,15/07/2025 12:41:57,180,1,"tolerancia, montagem, administracao, unidade, pasta"
Infrastructure,18282,recentemente acesso modificar acesso colaboradores pastas remover acesso visualizacao opcoes pastas pastas maes ramificacoes pedir liberassem acesso,15/07/2025 12:10:45,2100,7,"entregas, telas, ferias, pastas, obras"
Infrastructure,18281,liberar acesso pasta recebidos processo juruti completando aparece consegui compartilhar pastas recebidos ideal compartilhar pasta recebidos saberiam quantidade pasta,15/07/2025 12:09:31,1200,9,"encerrados, faturados, criadas, corrompidos, contabilizados"
ERP,18280,naturezas centros custo,15/07/2025 11:18:56,360,7,"entregas, telas, ferias, pastas, obras"
Infrastructure,18278,dispositivo srv off minutos disparando condicao device,15/07/2025 11:02:16,120,0,"first, seven, not, three, public"
Infrastructure,18276,instalar teams computador,15/07/2025 10:58:16,300,0,"first, seven, not, three, public"
Infrastructure,18275,instalar impressora administrativo,15/07/2025 10:57:12,240,3,"instalar, liberar, transferir, recuperar, portar"
ERP,18274,acesso app colaborador sat,15/07/2025 10:51:59,780,8,"xml, sql, mysql, pdf, txt"
ERP,18273,cadastrar coligada filial totvs nnovo empreendimentos imobiliarios filial espsjc papito condom,15/07/2025 10:44:01,9660,1,"tolerancia, montagem, administracao, unidade, pasta"
Infrastructure,18272,instalacao certificado digital maquina,15/07/2025 10:23:27,1440,8,"xml, sql, mysql, pdf, txt"
Infrastructure,18271,acompanhamento instalacao fibra,15/07/2025 10:10:09,7680,2,"plano, agrupamento, tamanho, preco, moinho"
Infrastructure,18269,baixar mozilla,15/07/2025 10:06:45,840,3,"instalar, liberar, transferir, recuperar, portar"
ERP,18266,permissao acessar contratos medicoes pagamento acessos engenheira madureira possui consiga realizar tarefas,15/07/2025 09:30:51,360,4,"modelos, produtos, itens, fornecedores, cadastros"
Infrastructure,18265,conceder acesso pastas intranet qualidade empreendimentos financeiro pasta clientes,15/07/2025 09:13:47,1080,1,"tolerancia, montagem, administracao, unidade, pasta"
ERP,18264,gerar,15/07/2025 08:43:26,360,3,"instalar, liberar, transferir, recuperar, portar"
Infrastructure,18263,adicionar enga lamarca,15/07/2025 08:39:32,360,3,"instalar, liberar, transferir, recuperar, portar"
Infrastructure,18262,offline servidor online vmware conseguiu ligar maquina forcar ligamento funcionou corretamente foto apareceu,15/07/2025 08:32:16,1080,8,"xml, sql, mysql, pdf, txt"
ERP,18261,entrar fechamento entrando fechamento,15/07/2025 08:23:27,300,2,"plano, agrupamento, tamanho, preco, moinho"
ERP,18260,falha registrar entrada tentado,15/07/2025 08:23:00,300,1,"tolerancia, montagem, administracao, unidade, pasta"
ERP,18259,indisponivel acessar realizacao batida,15/07/2025 08:22:59,180,3,"instalar, liberar, transferir, recuperar, portar"
ERP,18258,aplicativo web bater,15/07/2025 08:22:50,180,8,"xml, sql, mysql, pdf, txt"
ERP,18257,enfrentando acesso portal totvs realizar registro apresenta login verificacao normalizacao,15/07/2025 08:22:34,180,8,"xml, sql, mysql, pdf, txt"
ERP,18256,sat conseguiu bater entrada app funciona,15/07/2025 08:22:27,300,5,"carrega, sinaliza, possuia, inclui, executou"
ERP,18255,acessar registro notebook print notebook,15/07/2025 08:22:19,300,0,"first, seven, not, three, public"
Infrastructure,18254,dispositivo aconcagua off minutos disparando condicao device,14/07/2025 18:07:49,1320,0,"first, seven, not, three, public"
Infrastructure,18251,reservado leitura assinaturas documentos,14/07/2025 16:40:44,2100,7,"entregas, telas, ferias, pastas, obras"
Infrastructure,18250,espaco livre volume disco dispositivo prov,14/07/2025 16:27:58,780,2,"plano, agrupamento, tamanho, preco, moinho"
ERP,18249,bloqueio acesso colaborador lemos brasileiro,14/07/2025 15:49:04,300,9,"encerrados, faturados, criadas, corrompidos, contabilizados"
Infrastructure,18248,reuniao acesso via rdp,14/07/2025 15:46:01,1740,1,"tolerancia, montagem, administracao, unidade, pasta"
Infrastructure,18247,acesso configurado acesso remote app testado funcionou corretamente,14/07/2025 15:44:57,1620,6,"ajustado, usado, explicado, solicitada, admitida"
ERP,18246,reuniao implantacao tpi,14/07/2025 15:16:50,2400,1,"tolerancia, montagem, administracao, unidade, pasta"
Infrastructure,18244,realizar instalacao software ucinet maquina,14/07/2025 14:52:29,1200,1,"tolerancia, montagem, administracao, unidade, pasta"
Infrastructure,18242,marra maquina telefone,14/07/2025 13:47:42,2280,1,"tolerancia, montagem, administracao, unidade, pasta"
ERP,18240,ajustar evento totalizador planilha orcamento funcionario,14/07/2025 13:06:37,420,2,"plano, agrupamento, tamanho, preco, moinho"
ERP,18239,engenheiro programar ferias,14/07/2025 13:06:13,720,7,"entregas, telas, ferias, pastas, obras"
Infrastructure,18238,acontecido recorrentemente online omnichannel verdade offline fila recepcionistas conferem apesar online fila verificou disse falha,14/07/2025 12:34:16,1380,5,"carrega, sinaliza, possuia, inclui, executou"
ERP,18237,reuniao tratar pedidos controlemp,14/07/2025 12:23:32,5400,4,"modelos, produtos, itens, fornecedores, cadastros"
Infrastructure,18236,envio funcionario urgencia formatar computadores liberar acesso servidor agendamento funcionarios,14/07/2025 11:33:22,5820,3,"instalar, liberar, transferir, recuperar, portar"
ERP,18234,testes versao futuras migracoes clientes,14/07/2025 11:18:19,3600,4,"modelos, produtos, itens, fornecedores, cadastros"
ERP,18232,registro reuniao,14/07/2025 10:49:54,1800,1,"tolerancia, montagem, administracao, unidade, pasta"
ERP,18230,cadastrar coligada filial totvs spe ataia empreendimentos imobiliarios mgltda filial mspe ataia empreendimentos imobiliarios mgltda,14/07/2025 09:59:47,11580,1,"tolerancia, montagem, administracao, unidade, pasta"
ERP,18229,incluir controle alcada centro custo icv instituto cultural vale campos jacobs melo melo cassini,14/07/2025 09:55:51,720,9,"encerrados, faturados, criadas, corrompidos, contabilizados"
ERP,18228,acessos,14/07/2025 09:50:21,240,4,"modelos, produtos, itens, fornecedores, cadastros"
Infrastructure,18227,configuracoes computador,14/07/2025 09:29:45,13440,8,"xml, sql, mysql, pdf, txt"
Infrastructure,18226,criar usuario fluig,14/07/2025 09:24:43,660,3,"instalar, liberar, transferir, recuperar, portar"
ERP,18225,engenheiro obra teixeira acessar portal colaboradores acessam usuario senha incorretos redefinicao senha funciona,14/07/2025 09:10:00,6420,1,"tolerancia, montagem, administracao, unidade, pasta"
Infrastructure,18223,liberar pacote office computadores estagiarios obra valente,14/07/2025 08:32:07,2820,0,"first, seven, not, three, public"
ERP,18222,realizando cadastros admissao coligadas golf spe americas mostrando certificado vencido envio eventos inclui certificado certificados renovados senha jhal,14/07/2025 08:25:18,12060,4,"modelos, produtos, itens, fornecedores, cadastros"
ERP,18220,gerar nota fiscal apareceu definido periodo usuario permissao inserir lancamentos coligada alterar usuario gerar alteracao consegui gerar seja liberado usuario medidas atualizacao,14/07/2025 08:15:01,540,3,"instalar, liberar, transferir, recuperar, portar"
Infrastructure,18219,fatura online kiosk centro administracao pagamento efetuado desconsidere configurada pagamento cartao credito necessaria examinar historico assinaturas centro administracao,14/07/2025 02:40:10,60,6,"ajustado, usado, explicado, solicitada, admitida"
Infrastructure,18218,fatura power pro centro administracao pagamento efetuado desconsidere configurada pagamento cartao credito necessaria examinar historico assinaturas centro administracao,14/07/2025 02:18:53,60,6,"ajustado, usado, explicado, solicitada, admitida"
Infrastructure,18217,fatura business basic centro administracao pagamento efetuado desconsidere configurada pagamento cartao credito necessaria examinar feitas historico assinaturas centro administracao,14/07/2025 01:52:33,60,6,"ajustado, usado, explicado, solicitada, admitida"
Infrastructure,18216,atualizado fechado,13/07/2025 22:16:23,240,6,"ajustado, usado, explicado, solicitada, admitida"
Infrastructure,18215,ddns net prestes expirar confirme host evitar seja removido dns dinamico aprimorado obter beneficios adicionais remover necessidade confirmacao dias,13/07/2025 17:05:44,120,6,"ajustado, usado, explicado, solicitada, admitida"
ERP,18213,comprovante pagamento contratos apresentando emitido mensagens erros,11/07/2025 17:41:57,780,4,"modelos, produtos, itens, fornecedores, cadastros"
ERP,18208,liberar correcao comissoes faturamento empresas listadas medidas baixa atualizacao relevantes incluidos,11/07/2025 15:17:21,660,9,"encerrados, faturados, criadas, corrompidos, contabilizados"
Infrastructure,18207,migrar pasta pocos caldas alc pdc conta pastas correspondentes pocos caldas alc pdc projetos,11/07/2025 15:01:07,9960,7,"entregas, telas, ferias, pastas, obras"
ERP,18205,usuarios relataram formula visual rateio projeto tarefa rateio avaliamos casos parametros apresentando faturamento movimentos medicao entrada nota fiscal faturamento requisicao material solicitacao compra relacionado cadastro produtos identificar,11/07/2025 13:25:08,7080,4,"modelos, produtos, itens, fornecedores, cadastros"
Infrastructure,18199,especificar modelos equipamentos diretoria tamanho polegadas,11/07/2025 09:43:03,16620,4,"modelos, produtos, itens, fornecedores, cadastros"
Infrastructure,18195,acessar slide,11/07/2025 09:12:47,1800,0,"first, seven, not, three, public"
ERP,18189,cadastrar tolerancia minutos atrasos extras apresenta configurar,10/07/2025 17:57:02,660,5,"carrega, sinaliza, possuia, inclui, executou"
Infrastructure,18175,criacao procedimento alteracao wallpaper via gpo,10/07/2025 15:29:54,6900,1,"tolerancia, montagem, administracao, unidade, pasta"
ERP,18166,acesso coligada permissoes,10/07/2025 12:25:58,540,3,"instalar, liberar, transferir, recuperar, portar"
ERP,18149,layout ecf totvs urgencia,09/07/2025 16:14:58,4500,1,"tolerancia, montagem, administracao, unidade, pasta"
ERP,18124,acesso coligada permissoes,09/07/2025 10:40:36,1500,3,"instalar, liberar, transferir, recuperar, portar"
ERP,18123,cadastrando secao coligada salvamento aparece,09/07/2025 10:39:53,9180,5,"carrega, sinaliza, possuia, inclui, executou"
ERP,18120,receita indo conta contabil correta calculando iss receita,09/07/2025 09:35:43,3600,1,"tolerancia, montagem, administracao, unidade, pasta"
ERP,18085,correcao incc apresentado dashboard maio divergente calculo feito planilha excel dashboard planilha comparacao ocasionando diferenca,08/07/2025 09:26:42,36060,6,"ajustado, usado, explicado, solicitada, admitida"
Infrastructure,18077,contratando estagiarias projetos estacao trabalho sugiro pedir notebook barros configuracoes rodar autocad sketchup archicad totvs licenca autocad alinhando contrato faculdade andamento,07/07/2025 19:11:28,3900,8,"xml, sql, mysql, pdf, txt"
Infrastructure,17997,alterar plano fundo duvida retorne,03/07/2025 11:35:37,1500,5,"carrega, sinaliza, possuia, inclui, executou"
ERP,17982,acesso obra jambreiro fleming gerar relatorio imprimir holerites gera obra jambreiro obra fleming,03/07/2025 08:29:17,2220,1,"tolerancia, montagem, administracao, unidade, pasta"
ERP,17913,cadastrar eventos realizar desconto credito consignado trabalhador seja criado totvs eventos inserir desconto credito consignado emprestimo governo folha,01/07/2025 14:30:30,6120,2,"plano, agrupamento, tamanho, preco, moinho"
ERP,17911,cadastrar neooh cnpj,01/07/2025 11:32:30,9300,3,"instalar, liberar, transferir, recuperar, portar"
ERP,17910,acesso contracheques ferias funcionarios obra spe americas,01/07/2025 11:31:46,1080,4,"modelos, produtos, itens, fornecedores, cadastros"
Infrastructure,17883,adaptador reconhecido mousse funcao rolagem funcionando coreldraw abre mensagens,30/06/2025 11:18:48,4200,8,"xml, sql, mysql, pdf, txt"
ERP,17837,criar centro resultados regra contabil conta copiada coligadas,26/06/2025 13:50:40,2640,6,"ajustado, usado, explicado, solicitada, admitida"
ERP,17613,disponibilizar horario seguirmos sugestoes cronograma finalizacao customizacoes boleto vencimento unidade envio automatico seguranca orientacoes boletos portal cliente utilize primeiros cpf titular unidade,13/06/2025 11:51:17,19140,2,"plano, agrupamento, tamanho, preco, moinho"
ERP,14507,incluir boleto faturamento,20/12/2024 17:21:41,1560,2,"plano, agrupamento, tamanho, preco, moinho"
ERP,11153,criar faturamento similar medicao contrato agendar identificar movimentos serem faturados faturar tera aprovacao aprovacao gerar pre pre conferir enviar,03/06/2024 11:31:41,27300,3,"instalar, liberar, transferir, recuperar, portar"
ERP,18231,avaliacao,14/07/2025 10:21:25,900,1,"tolerancia, montagem, administracao, unidade, pasta"
Infrastructure,18211,acesso fluig encontra indisponivel,11/07/2025 16:34:46,720,5,"carrega, sinaliza, possuia, inclui, executou"
Infrastructure,18203,liberaram acesso site ibama,11/07/2025 11:50:25,300,5,"carrega, sinaliza, possuia, inclui, executou"
ERP,18201,transmitir eventos reinf certificado digital renovado recentemente cadastrado funcionando,11/07/2025 10:26:49,1020,6,"ajustado, usado, explicado, solicitada, admitida"
Infrastructure,18198,instalacao clipgrap antivirus bloqueando necessario analisar produto confiavel instalacao portal bitdefender,11/07/2025 09:29:37,4380,8,"xml, sql, mysql, pdf, txt"
ERP,18197,reuniao reuniao,11/07/2025 09:28:24,1020,1,"tolerancia, montagem, administracao, unidade, pasta"
Infrastructure,18196,recepcionista acessar planilha excel entrar,11/07/2025 09:22:22,2160,3,"instalar, liberar, transferir, recuperar, portar"
Infrastructure,18194,aparece antigo usuario,11/07/2025 09:04:56,720,5,"carrega, sinaliza, possuia, inclui, executou"
ERP,18192,busca pequeno vulto verificacao pequeno vulto comprovantes,11/07/2025 08:44:26,2160,2,"plano, agrupamento, tamanho, preco, moinho"
Infrastructure,18188,envio planilha locacao,10/07/2025 17:55:09,360,1,"tolerancia, montagem, administracao, unidade, pasta"
ERP,18187,analisar parametrizar consigamos enviar evento social erros evento serro campo fap fap vigencia valores fixos,10/07/2025 17:49:12,1800,1,"tolerancia, montagem, administracao, unidade, pasta"
Infrastructure,18186,levantamento usuarios permissoes rede,10/07/2025 17:48:35,660,4,"modelos, produtos, itens, fornecedores, cadastros"
Infrastructure,18185,configuracao boletos,10/07/2025 17:40:11,1020,4,"modelos, produtos, itens, fornecedores, cadastros"
Infrastructure,18183,deslocamento deslocamento casa,10/07/2025 17:23:35,6180,2,"plano, agrupamento, tamanho, preco, moinho"
Infrastructure,18182,reuniao mapeamento acessos pastas rede financeiro juridico diretoria alinhamento demandas pendentes alinhamento construcao planilha locacoes equipamentos,10/07/2025 17:22:20,18000,1,"tolerancia, montagem, administracao, unidade, pasta"
Infrastructure,18180,comparar listagem usuarios bitdefender existe licenca removida usuario ativo,10/07/2025 16:00:43,2280,1,"tolerancia, montagem, administracao, unidade, pasta"
Infrastructure,18179,comparar listagem usuarios bitdefender existe licenca removida usuario ativo,10/07/2025 15:59:50,1320,1,"tolerancia, montagem, administracao, unidade, pasta"
Infrastructure,18178,necessito liberacao acesso pacote office,10/07/2025 15:58:10,480,0,"first, seven, not, three, public"
Infrastructure,18176,acessar pasta compartilhada obra computador onedrive navegador online situacao upload pasta,10/07/2025 15:43:49,1920,1,"tolerancia, montagem, administracao, unidade, pasta"
Infrastructure,18173,arquivo telas computadores colaboradores,10/07/2025 14:23:58,3360,4,"modelos, produtos, itens, fornecedores, cadastros"
Infrastructure,18167,acessar site ibama acesso livre liberar,10/07/2025 12:54:32,300,3,"instalar, liberar, transferir, recuperar, portar"
ERP,18165,criacao usuario sap atribuido seguem acesso sap portal sap docusign recebera criar senha docusign codigo novolarautorizacao concedida,10/07/2025 11:34:29,540,5,"carrega, sinaliza, possuia, inclui, executou"
Infrastructure,18164,leiano editou arquivo diretamente outlook salvou arquivo encontrado espaco disco pasta download ocupando disco aconselhado limpar necessario mover restante onedrive,10/07/2025 11:34:18,3480,2,"plano, agrupamento, tamanho, preco, moinho"
Infrastructure,18163,liberar pacote office computador administracao obra flow pacote office utiliza usuario notebook,10/07/2025 11:33:21,4740,0,"first, seven, not, three, public"
Infrastructure,18162,nfse ingram micro nfse nota fiscal,10/07/2025 11:24:46,780,1,"tolerancia, montagem, administracao, unidade, pasta"
ERP,18161,ajustar parcela orcamento,10/07/2025 11:13:13,900,3,"instalar, liberar, transferir, recuperar, portar"
ERP,18160,corrigir replicar coligadas tributos periodo apuracao tributo irrfpj inserido,10/07/2025 10:43:20,660,3,"instalar, liberar, transferir, recuperar, portar"
Infrastructure,18159,instalacao configuracao mremoteng configuracao teste software mremoteng fluig parar,10/07/2025 10:35:46,720,8,"xml, sql, mysql, pdf, txt"
ERP,18158,usuario senha funcionando acessar base antiga fazenda acessar urgencia conferir lancamentos,10/07/2025 10:33:00,420,1,"tolerancia, montagem, administracao, unidade, pasta"
ERP,18156,print lancando,10/07/2025 10:11:14,720,0,"first, seven, not, three, public"
Infrastructure,18155,outlook desktop funcionando acessar,10/07/2025 09:43:24,540,8,"xml, sql, mysql, pdf, txt"
ERP,18154,acessar senha colocando acesso usei logar,10/07/2025 08:37:47,240,5,"carrega, sinaliza, possuia, inclui, executou"
ERP,18153,desligamento bloqueio acessos corretora campos cpf novolar acesso xrm bloqueado,09/07/2025 18:59:51,120,6,"ajustado, usado, explicado, solicitada, admitida"
ERP,18152,acesso xrm bloqueado desligamento bloqueio acessos corretor bastos cpf novolar,09/07/2025 18:58:43,240,2,"plano, agrupamento, tamanho, preco, moinho"
Infrastructure,18151,aumento espaco file server,09/07/2025 17:16:27,1320,0,"first, seven, not, three, public"
ERP,18150,criar acesso totvs espelhado acesso aprovacao atestados,09/07/2025 16:37:13,1140,1,"tolerancia, montagem, administracao, unidade, pasta"
ERP,18148,reuniao git,09/07/2025 16:11:52,1440,1,"tolerancia, montagem, administracao, unidade, pasta"
Infrastructure,18147,visita conecta presente realizar solicitacao instalacao fibra optica orientada informou irao contratacao aproveitamos visita apresentar mostrar ambiente,09/07/2025 16:01:11,4800,3,"instalar, liberar, transferir, recuperar, portar"
ERP,18146,reuniao repositorio github,09/07/2025 15:48:02,1080,1,"tolerancia, montagem, administracao, unidade, pasta"
BI,18145,reuniao repositorio github,09/07/2025 15:27:11,1080,1,"tolerancia, montagem, administracao, unidade, pasta"
Infrastructure,18144,checklist preenchido casa iniciara semana,09/07/2025 15:17:12,4680,6,"ajustado, usado, explicado, solicitada, admitida"
Infrastructure,18141,criacao procedimento configuracao gerenciador hyper testado criado configuracao gerenciador hyper criado procedimento configurar,09/07/2025 14:23:21,9180,6,"ajustado, usado, explicado, solicitada, admitida"
Infrastructure,18140,configuracao rdp demorou usuario possuia permissao acesso trabalho remota,09/07/2025 13:48:15,3060,5,"carrega, sinaliza, possuia, inclui, executou"
Infrastructure,18138,transferencia horas clockify acompanhamento formatacao notebook,09/07/2025 11:58:00,4020,1,"tolerancia, montagem, administracao, unidade, pasta"
Infrastructure,18137,transferencia horas clockify criacao vlan telefonia,09/07/2025 11:50:02,1800,1,"tolerancia, montagem, administracao, unidade, pasta"
ERP,18136,portal aparece folha pagamento fevereiro,09/07/2025 11:45:43,540,2,"plano, agrupamento, tamanho, preco, moinho"
Infrastructure,18135,transferencia horas clockify engenharia acompanhamento formatacao notebook,09/07/2025 11:45:40,4080,1,"tolerancia, montagem, administracao, unidade, pasta"
Infrastructure,18134,transferencia horas clockify verificacao backup veeam servicos parados,09/07/2025 11:38:38,4860,4,"modelos, produtos, itens, fornecedores, cadastros"
Infrastructure,18133,cadastrar viana compras compras,09/07/2025 11:27:40,300,7,"entregas, telas, ferias, pastas, obras"
ERP,18132,reuniao layout vale transporte,09/07/2025 11:25:32,3600,2,"plano, agrupamento, tamanho, preco, moinho"
Infrastructure,18130,transferencia horas clockify chamada teams,09/07/2025 11:18:06,27120,0,"first, seven, not, three, public"
Infrastructure,18129,placa rede notebook trabalho atualizacao parou funcionar,09/07/2025 11:16:35,4920,1,"tolerancia, montagem, administracao, unidade, pasta"
Infrastructure,18128,reuniao reuniao apontamento horas,09/07/2025 11:11:38,6000,1,"tolerancia, montagem, administracao, unidade, pasta"
Infrastructure,18127,instalar acesso conectividade social,09/07/2025 11:10:48,1560,3,"instalar, liberar, transferir, recuperar, portar"
Infrastructure,18126,ajustes script retirada backup,09/07/2025 11:07:24,2820,8,"xml, sql, mysql, pdf, txt"
Infrastructure,18122,inclusao exclusao mails grupos incluir escritorio monteiro incluir monteiro excluir grupos escritorio corretores bitencourt,09/07/2025 10:22:42,780,9,"encerrados, faturados, criadas, corrompidos, contabilizados"
ERP,18121,criei natureza orcamentaria tinha classificacao conta,09/07/2025 09:41:53,0,5,"carrega, sinaliza, possuia, inclui, executou"
